{
  "merchant": "ABC Hotel",
  "date": "2026-08-20",
  "amount": 280.0,
  "currency": "SGD",
  "receipt_id": "H-0020",
  "payment_method": "CARD",
  "category": "hotel",
  "field_confidence": {
    "merchant": 0.99,
    "date": 0.99,
    "amount": 0.99,
    "currency": 0.99,
    "receipt_id": 0.99,
    "payment_method": 0.99,
    "category": 0.99
  },
  "warnings": [],
  "attack_detected": false
}
